{
  "schemaVersion": "phase2.atomic-manifest.v3",
  "taxonomy": {
    "contractVersion": "phase2.search-card-taxonomy.v1",
    "file": "phase2-card-annotation/references/search_card_taxonomy.v1.json",
    "sha256": "5a58f382741b9cc27411b7b0441403fd2ecabdb01be2fbaabb49b808ad4534e0"
  },
  "source": {
    "query": "烧烤",
    "screenshot": "phase2-card-annotation/golden-samples/merchant-graphic-hang/component-level/商家卡片-图文下挂-搜索词为烧烤.png",
    "sha256": "440faadb1efb0e60f50503b957cbae9d49cd34b2bf1675af9b6ad2c988a34c26",
    "viewport": [
      1224,
      2700
    ]
  },
  "publication": {
    "status": "ready",
    "blockers": []
  },
  "page": {
    "moduleIds": [
      "M1",
      "M2",
      "M3",
      "M4"
    ]
  },
  "modulesById": {
    "M1": {
      "type": "search_bar",
      "visibility": "confirmed",
      "bounds": [
        135,
        176,
        894,
        97
      ],
      "slots": {
        "other": [
          "M1-E001"
        ]
      }
    },
    "M2": {
      "type": "page_tab",
      "visibility": "confirmed",
      "bounds": [
        0,
        291,
        1224,
        109
      ]
    },
    "M3": {
      "type": "sort_filter",
      "visibility": "confirmed",
      "bounds": [
        0,
        400,
        1224,
        136
      ]
    },
    "M4": {
      "type": "result_list",
      "visibility": "confirmed",
      "bounds": [
        0,
        554,
        1224,
        2146
      ],
      "cardIds": [
        "C1",
        "C2",
        "C3",
        "C4"
      ]
    }
  },
  "cardsById": {
    "C1": {
      "cardType": "merchant_graphic_append",
      "variant": "standard",
      "bounds": [
        0,
        554,
        1224,
        627
      ],
      "visibility": "complete",
      "regionIds": [
        "C1-R01",
        "C1-R02",
        "C1-R03",
        "C1-R04"
      ]
    },
    "C2": {
      "cardType": "merchant_graphic_append",
      "variant": "standard",
      "bounds": [
        0,
        1217,
        1224,
        627
      ],
      "visibility": "complete",
      "regionIds": [
        "C2-R01",
        "C2-R02",
        "C2-R03",
        "C2-R04",
        "C2-R05"
      ]
    },
    "C3": {
      "cardType": "merchant_graphic_append",
      "variant": "standard",
      "bounds": [
        0,
        1880,
        1224,
        627
      ],
      "visibility": "complete",
      "regionIds": [
        "C3-R01",
        "C3-R02",
        "C3-R03",
        "C3-R04",
        "C3-R05"
      ]
    },
    "C4": {
      "cardType": "merchant_graphic_append",
      "variant": "standard",
      "bounds": [
        0,
        2540,
        1224,
        160
      ],
      "visibility": "naturally_cropped",
      "regionIds": [
        "C4-R01",
        "C4-R02",
        "C4-R03",
        "C4-R04"
      ]
    }
  },
  "regionsById": {
    "C1-R01": {
      "name": "head_media",
      "bounds": [
        32,
        554,
        247,
        247
      ],
      "slots": {
        "media": [
          "C1-E001"
        ]
      }
    },
    "C1-R02": {
      "name": "title",
      "bounds": [
        227,
        554,
        516,
        58
      ],
      "slots": {
        "fulfillment_tag": [
          "C1-E002"
        ],
        "title": [
          "C1-E003"
        ]
      }
    },
    "C1-R03": {
      "name": "merchant_info",
      "bounds": [
        227,
        626,
        966,
        41
      ],
      "slots": {
        "rating": [
          "C1-E004"
        ],
        "sales": [
          "C1-E005"
        ],
        "fulfillment": [
          "C1-E006",
          "C1-E007",
          "C1-E008"
        ]
      }
    },
    "C1-R04": {
      "name": "append_items",
      "bounds": [
        227,
        767,
        997,
        384
      ],
      "items": [
        {
          "index": 0,
          "bounds": [
            227,
            767,
            264,
            384
          ],
          "visibility": "complete",
          "slots": {
            "media": [
              "C1-E009"
            ],
            "title": [
              "C1-E010"
            ],
            "price": [
              "C1-E011"
            ]
          }
        },
        {
          "index": 1,
          "bounds": [
            504,
            767,
            264,
            384
          ],
          "visibility": "complete",
          "slots": {
            "media": [
              "C1-E012"
            ],
            "title": [
              "C1-E013"
            ],
            "price": [
              "C1-E014"
            ]
          }
        },
        {
          "index": 2,
          "bounds": [
            781,
            767,
            264,
            384
          ],
          "visibility": "complete",
          "slots": {
            "media": [
              "C1-E015"
            ],
            "title": [
              "C1-E016"
            ],
            "price": [
              "C1-E017"
            ]
          }
        },
        {
          "index": 3,
          "bounds": [
            1058,
            767,
            166,
            383
          ],
          "visibility": "naturally_cropped",
          "slots": {
            "media": [
              "C1-E018"
            ],
            "title": [
              "C1-E019"
            ],
            "price": [
              "C1-E020"
            ]
          }
        }
      ]
    },
    "C2-R01": {
      "name": "head_media",
      "bounds": [
        32,
        1217,
        247,
        247
      ],
      "slots": {
        "media": [
          "C2-E001"
        ]
      }
    },
    "C2-R02": {
      "name": "title",
      "bounds": [
        233,
        1217,
        461,
        50
      ],
      "slots": {
        "fulfillment_tag": [
          "C2-E002"
        ],
        "title": [
          "C2-E003"
        ]
      }
    },
    "C2-R03": {
      "name": "merchant_info",
      "bounds": [
        227,
        1289,
        966,
        42
      ],
      "slots": {
        "rating": [
          "C2-E004"
        ],
        "sales": [
          "C2-E005"
        ],
        "fulfillment": [
          "C2-E006",
          "C2-E007"
        ]
      }
    },
    "C2-R04": {
      "name": "tags",
      "bounds": [
        402,
        1357,
        622,
        37
      ],
      "slots": {
        "merchant_feature_tag": [
          "C2-E008",
          "C2-E009"
        ]
      }
    },
    "C2-R05": {
      "name": "append_items",
      "bounds": [
        227,
        1430,
        997,
        384
      ],
      "items": [
        {
          "index": 0,
          "bounds": [
            227,
            1430,
            264,
            383
          ],
          "visibility": "complete",
          "slots": {
            "media": [
              "C2-E010"
            ],
            "title": [
              "C2-E011"
            ],
            "price": [
              "C2-E012"
            ]
          }
        },
        {
          "index": 1,
          "bounds": [
            504,
            1430,
            264,
            384
          ],
          "visibility": "complete",
          "slots": {
            "media": [
              "C2-E013"
            ],
            "title": [
              "C2-E014"
            ],
            "price": [
              "C2-E015"
            ]
          }
        },
        {
          "index": 2,
          "bounds": [
            781,
            1430,
            264,
            383
          ],
          "visibility": "complete",
          "slots": {
            "media": [
              "C2-E016"
            ],
            "title": [
              "C2-E017"
            ],
            "price": [
              "C2-E018"
            ]
          }
        },
        {
          "index": 3,
          "bounds": [
            1058,
            1430,
            166,
            384
          ],
          "visibility": "naturally_cropped",
          "slots": {
            "media": [
              "C2-E019"
            ],
            "title": [
              "C2-E020"
            ],
            "price": [
              "C2-E021"
            ]
          }
        }
      ]
    },
    "C3-R01": {
      "name": "head_media",
      "bounds": [
        32,
        1880,
        247,
        247
      ],
      "slots": {
        "media": [
          "C3-E001"
        ]
      }
    },
    "C3-R02": {
      "name": "title",
      "bounds": [
        227,
        1880,
        987,
        60
      ],
      "slots": {
        "fulfillment_tag": [
          "C3-E002"
        ],
        "title": [
          "C3-E003"
        ],
        "delivery_time": [
          "C3-E004"
        ]
      }
    },
    "C3-R03": {
      "name": "merchant_info",
      "bounds": [
        227,
        1952,
        966,
        42
      ],
      "slots": {
        "rating": [
          "C3-E005"
        ],
        "sales": [
          "C3-E006"
        ],
        "fulfillment": [
          "C3-E007",
          "C3-E008",
          "C3-E009"
        ]
      }
    },
    "C3-R04": {
      "name": "tags",
      "bounds": [
        398,
        2017,
        627,
        42
      ],
      "slots": {
        "merchant_feature_tag": [
          "C3-E010",
          "C3-E011"
        ]
      }
    },
    "C3-R05": {
      "name": "append_items",
      "bounds": [
        227,
        2093,
        997,
        383
      ],
      "items": [
        {
          "index": 0,
          "bounds": [
            227,
            2093,
            264,
            383
          ],
          "visibility": "complete",
          "slots": {
            "media": [
              "C3-E012"
            ],
            "title": [
              "C3-E013"
            ],
            "price": [
              "C3-E014"
            ]
          }
        },
        {
          "index": 1,
          "bounds": [
            504,
            2093,
            264,
            383
          ],